Here is imapsync 2.229 on host Whois, a linux system with 0.4/7.6 free GiB of RAM, 113.20% used by processes.
with Perl 5.34.0 and Mail::IMAPClient 3.43
Transfer started at sábado 26 agosto 2023-08-26 17:48:52 -0400 CDT
PID is 12847 my PPID is 12681
Log file is LOG_imapsync/2023_08_26_17_48_52_250_manuel.gorrin@umcc.cu_manuel.gorrin@umcc.cu.txt ( to change it, use --logfile path ; or use --nolog to turn off logging )
Load is 4.21 2.04 0.96 4/1057 on 4 cores
Current directory is /home/whois/Desktop/WebClientImapSync
Real user id is whois (uid 1000)
Effective user id is whois (euid 1000)
$RCSfile: imapsync,v $ $Revision: 2.229 $ $Date: 2022/09/14 18:08:24 $ 
Command line used, run by /usr/bin/perl:
/usr/bin/imapsync --host1 correo.umcc.cu --user1 manuel.gorrin@umcc.cu --password1 MASKED --host2 mail.umcc.cu --user2 manuel.gorrin@umcc.cu --password2 MASKED
Temp directory is /tmp ( to change it use --tmpdir dirpath )
kill -QUIT 12847 # special behavior: call to sub catch_exit
kill -TERM 12847 # special behavior: call to sub catch_exit
kill -INT 12847 # special behavior: call to sub catch_reconnect
kill -HUP 12847 # special behavior: call to sub catch_print
kill -USR1 12847 # special behavior: call to sub toggle_sleep
File /tmp/imapsync.pid does not exist
PID file is /tmp/imapsync.pid ( to change it, use --pidfile filepath ; to avoid it use --pidfile "" )
Writing my PID 12847 in /tmp/imapsync.pid
Writing also my logfile name in /tmp/imapsync.pid : LOG_imapsync/2023_08_26_17_48_52_250_manuel.gorrin@umcc.cu_manuel.gorrin@umcc.cu.txt
Modules version list ( use --no-modulesversion to turn off printing this Perl modules list ):
Authen::NTLM         1.09
CGI                  4.54
Compress::Zlib       2.102
Crypt::OpenSSL::RSA  0.32
Data::Uniqid         0.12
Digest::HMAC_MD5     1.04
Digest::HMAC_SHA1    1.04
Digest::MD5          2.58
Encode               3.08
Encode::IMAPUTF7     1.05
File::Copy::Recursive 0.45
File::Spec           3.80
Getopt::Long         2.52
HTML::Entities       3.76
IO::Socket           1.46
IO::Socket::INET     1.46
IO::Socket::INET6    2.73
IO::Socket::IP       0.41
IO::Socket::SSL      2.074
IO::Tee              0.65
JSON                 4.04
JSON::WebToken       0.10
LWP                  6.61
MIME::Base64         3.16
Mail::IMAPClient     3.43
Net::Ping            2.74
Net::SSLeay          1.92
Term::ReadKey        2.38
Test::MockObject     1.20200122
Time::HiRes          1.9767
URI::Escape          5.10
Unicode::String      2.10

Info: will resync flags for already transferred messages. Use --noresyncflags to not resync flags.
Host1: probing ssl on port 993 ( use --nosslcheck to avoid this ssl probe ) 
Host1: sslcheck detected open ssl port 993 so turning ssl on (use --nossl1 --notls1 to turn off SSL and TLS wizardry)
Host2: probing ssl on port 993 ( use --nosslcheck to avoid this ssl probe ) 
Host2: sslcheck detected open ssl port 993 so turning ssl on (use --nossl2 --notls2 to turn off SSL and TLS wizardry)
SSL debug mode level is --debugssl 1 (can be set from 0 meaning no debug to 4 meaning max debug)
Host1: SSL default mode is like --sslargs1 "SSL_verify_mode=0", meaning for host1 SSL_VERIFY_NONE, ie, do not check the server certificate.
Host1: Use --sslargs1 SSL_verify_mode=1 to have SSL_VERIFY_PEER, ie, check the server certificate. of host1
Host2: SSL default mode is like --sslargs2 "SSL_verify_mode=0", meaning for host2 SSL_VERIFY_NONE, ie, do not check the server certificate.
Host2: Use --sslargs2 SSL_verify_mode=1 to have SSL_VERIFY_PEER, ie, check the server certificate. of host2
Info: turned ON syncinternaldates, will set the internal dates (arrival dates) on host2 same as host1.
Host1: will try to use LOGIN authentication on host1
Host2: will try to use LOGIN authentication on host2
Host1: imap connection timeout is 120 seconds
Host2: imap connection timeout is 120 seconds
Host1: imap connection keepalive is on on host1. Use --nokeepalive1 to disable it.
Host2: imap connection keepalive is on on host2. Use --nokeepalive2 to disable it.
Host1: IMAP server [correo.umcc.cu] port [993] user [manuel.gorrin@umcc.cu]
Host2: IMAP server [mail.umcc.cu] port [993] user [manuel.gorrin@umcc.cu]
Host1: connecting and login on host1 [correo.umcc.cu] port [993] with user [manuel.gorrin@umcc.cu]
Host1 IP address: 10.34.8.9 Local IP address: 192.168.0.119
Host1 banner: * OK IMAP4rev1 proxy server ready
Host1 capability before authentication: ACL BINARY CATENATE CHILDREN CONDSTORE ENABLE ESEARCH ESORT I18NLEVEL=1 ID IDLE IMAP4rev1 LIST-EXTENDED LIST-STATUS LITERAL+ MULTIAPPEND NAMESPACE QRESYNC QUOTA RIGHTS=ektx SASL-IR SEARCHRES SORT THREAD=ORDEREDSUBJECT UIDPLUS UNSELECT WITHIN XLIST AUTH=PLAIN I18NLEVEL RIGHTS THREAD AUTH
Host1: success login on [correo.umcc.cu] with user [manuel.gorrin@umcc.cu] auth [LOGIN] or [LOGIN]
Host2: connecting and login on host2 [mail.umcc.cu] port [993] with user [manuel.gorrin@umcc.cu]
Host2 IP address: 10.34.8.163 Local IP address: 192.168.0.119
Host2 banner: * OK [CAPABILITY IMAP4rev1 SASL-IR LOGIN-REFERRALS ID ENABLE IDLE LITERAL+ AUTH=PLAIN AUTH=LOGIN] Dovecot ready OK+.
Host2 capability before authentication: IMAP4rev1 SASL-IR LOGIN-REFERRALS ID ENABLE IDLE LITERAL+ AUTH=PLAIN AUTH=LOGIN AUTH
Host2: mail.umcc.cu says it has CAPABILITY for AUTHENTICATE LOGIN
Host2: success login on [mail.umcc.cu] with user [manuel.gorrin@umcc.cu] auth [LOGIN] or [LOGIN]
Host1: state Authenticated
Host2: state Authenticated
Host1 capability once authenticated: IMAP4rev1 ACL BINARY CATENATE CHILDREN CONDSTORE ENABLE ESEARCH ESORT I18NLEVEL=1 ID IDLE LIST-EXTENDED LIST-STATUS LITERAL+ LOGIN-REFERRALS MULTIAPPEND NAMESPACE QRESYNC QUOTA RIGHTS=ektx SASL-IR SEARCHRES SORT THREAD=ORDEREDSUBJECT UIDPLUS UNSELECT WITHIN XLIST I18NLEVEL RIGHTS THREAD
Host2 capability once authenticated: IMAP4rev1 SASL-IR LOGIN-REFERRALS ID ENABLE IDLE SORT SORT=DISPLAY THREAD=REFERENCES THREAD=REFS THREAD=ORDEREDSUBJECT MULTIAPPEND URL-PARTIAL CATENATE UNSELECT CHILDREN NAMESPACE UIDPLUS LIST-EXTENDED I18NLEVEL=1 CONDSTORE QRESYNC ESEARCH ESORT SEARCHRES WITHIN CONTEXT=SEARCH LIST-STATUS BINARY MOVE SNIPPET=FUZZY PREVIEW=FUZZY STATUS=SIZE SAVEDATE LITERAL+ NOTIFY SPECIAL-USE ACL RIGHTS=texk THREAD I18NLEVEL CONTEXT SNIPPET PREVIEW STATUS RIGHTS
Host1: found ID capability. Sending/receiving ID, presented in raw IMAP for now.
In order to avoid sending/receiving ID, use option --noid
Sending: 4 ID ("name" "imapsync" "version" "2.229" "os" "linux" "vendor" "Gilles LAMIRAL" "support-url" "https://imapsync.lamiral.info/" "date" "14-Sep-2022 18:08:24 +0000" "side" "host1")
Sent 181 bytes
Read: 	* ID ("NAME" "Zimbra" "VERSION" "10.0.0_GA_0001" "RELEASE" "20230418135109" "USER" "manuel.gorrin@umcc.cu" "SERVER" "690b31c7-ac9d-4d90-bd95-7b72e088ae2e")
  	4 OK ID completed
Host2: found ID capability. Sending/receiving ID, presented in raw IMAP for now.
In order to avoid sending/receiving ID, use option --noid
Sending: 4 ID ("name" "imapsync" "version" "2.229" "os" "linux" "vendor" "Gilles LAMIRAL" "support-url" "https://imapsync.lamiral.info/" "date" "14-Sep-2022 18:08:24 +0000" "side" "host2")
Sent 181 bytes
Read: 	* ID ("name" "Dovecot")
  	4 OK ID completed (0.001 + 0.000 secs).
Host2: No QUOTA capability found, skipping it.
Host1: Compression is off. Use --compress1 to allow compression on host1
Host2: Compression is off. Use --compress2 to allow compression on host2
Host1: found 7 folders.
Host2: found 9 folders.
Host1: guessing separator from folder listing: [/]
Host1: separator given by NAMESPACE: [/]
Host2: guessing separator from folder listing: [/]
Host2: separator given by NAMESPACE: [/]
Host1: guessing prefix from folder listing: []
Host1: prefix given by NAMESPACE: []
Host2: guessing prefix from folder listing: []
Host2: prefix given by NAMESPACE: []
Host1: separator and prefix: [/][]
Host2: separator and prefix: [/][]
Including all folders found by default. Use --subscribed or --folder or --folderrec or --include to select specific folders. Use --exclude to unselect specific folders.
Host1: Checking wanted folders exist. Use --nocheckfoldersexist to avoid this check (shared of public namespace targeted).
Host1: Checking wanted folders are selectable. Use --nocheckselectable to avoid this check.
Turned off automapping folders ( use --automap to turn on automapping )

++++ Listing folders
All foldernames are presented between brackets like [X] where X is the foldername.
When a foldername contains non-ASCII characters it is presented in the form
[X] = [Y] where
X is the imap foldername you have to use in command line options and
Y is the utf8 output just printed for convenience, to recognize it.

Host1: folders list (first the raw imap format then the [X] = [Y]):
* LIST (\HasNoChildren) "/" "Comments"
* LIST (\HasNoChildren \Drafts) "/" "Drafts"
* LIST (\HasNoChildren) "/" "INBOX"
* LIST (\NoInferiors \Junk) "/" "Junk"
* LIST (\HasNoChildren) "/" "Notes"
* LIST (\HasNoChildren \Sent) "/" "Sent"
* LIST (\HasNoChildren \Trash) "/" "Trash"
16 OK LIST completed

[Comments]
[Drafts]
[INBOX]
[Junk]
[Notes]
[Sent]
[Trash]

Host2: folders list (first the raw imap format then the [X] = [Y]):
* LIST (\HasNoChildren) "/" Notes
* LIST (\HasNoChildren) "/" Comments
* LIST (\HasNoChildren \UnMarked \Junk) "/" Spam
* LIST (\HasNoChildren \UnMarked \Archive) "/" Archive
* LIST (\HasNoChildren \Trash) "/" Trash
* LIST (\HasNoChildren \UnMarked \Junk) "/" Junk
* LIST (\HasNoChildren \UnMarked \Drafts) "/" Drafts
* LIST (\HasNoChildren \Sent) "/" Sent
* LIST (\HasNoChildren) "/" INBOX
9 OK List completed (0.001 + 0.000 secs).

[Archive]
[Comments]
[Drafts]
[INBOX]
[Junk]
[Notes]
[Sent]
[Spam]
[Trash]

Folders in host2 not in host1:
[Spam]
[Archive]

Checking SEARCH ALL works on both accounts. To avoid that check, use --nochecknoabletosearch
Host1: checking if SEARCH ALL works on INBOX
Host1: folder [INBOX] has 33 messages mentioned by SELECT
Host1: folder [INBOX] has 33 messages found by SEARCH ALL
Host1: folder [INBOX] has the same messages count (33) by SELECT and SEARCH ALL
Host2: checking if SEARCH ALL works on INBOX
Host2: folder [INBOX] has 0 messages mentioned by SELECT
Host2: folder [INBOX] has 0 messages found by SEARCH ALL
Host2: folder [INBOX] has the same messages count (0) by SELECT and SEARCH ALL
Good! SEARCH ALL works on both accounts.

Folders sizes before the synchronization. It can take some time. Be patient.
You can remove foldersizes listings by using "--nofoldersizes" and "--nofoldersizesatend"
but then you will also lose the ETA (Estimation Time of Arrival) given after each message copy.
Host1 folder     1/7 [Comments]                          Size:         0 Messages:     0 Biggest:         0
Host2 folder     1/7 [Comments]                          Size:         0 Messages:     0 Biggest:         0
Host2-Host1                                                            0               0                  0

Host1 folder     2/7 [Drafts]                            Size:         0 Messages:     0 Biggest:         0
Host2 folder     2/7 [Drafts]                            Size:         0 Messages:     0 Biggest:         0
Host2-Host1                                                            0               0                  0

Host1 folder     3/7 [INBOX]                             Size:   4713809 Messages:    33 Biggest:   2411346
Host2 folder     3/7 [INBOX]                             Size:         0 Messages:     0 Biggest:         0
Host2-Host1                                                     -4713809             -33           -2411346

Host1 folder     4/7 [Junk]                              Size:         0 Messages:     0 Biggest:         0
Host2 folder     4/7 [Junk]                              Size:         0 Messages:     0 Biggest:         0
Host2-Host1                                                            0               0                  0

Host1 folder     5/7 [Notes]                             Size:         0 Messages:     0 Biggest:         0
Host2 folder     5/7 [Notes]                             Size:         0 Messages:     0 Biggest:         0
Host2-Host1                                                            0               0                  0

Host1 folder     6/7 [Sent]                              Size:  18247349 Messages:   189 Biggest:   4898722
Host2 folder     6/7 [Sent]                              Size:         0 Messages:     0 Biggest:         0
Host2-Host1                                                    -18247349            -189           -4898722

Host1 folder     7/7 [Trash]                             Size:  60203812 Messages:   312 Biggest:  10004307
Host2 folder     7/7 [Trash]                             Size: 181002450 Messages:  1052 Biggest:  10004307
Host2-Host1                                                    120798638             740                  0

Host1 Nb folders:                     7 folders
Host2 Nb folders:                     7 folders

Host1 Nb messages:                  534 messages
Host2 Nb messages:                 1052 messages

Host1 Total size:              83164970 bytes (79.312 MiB)
Host2 Total size:             181002450 bytes (172.617 MiB)

Host1 Biggest message:         10004307 bytes (9.541 MiB)
Host2 Biggest message:         10004307 bytes (9.541 MiB)

Time spent on sizing:         1.4 seconds
++++ Looping on each one of 7 folders to sync
ETA: sábado 26 agosto 2023-08-26 17:48:53 -0400 CDT  0 s  534/534 msgs left
Folder     1/7 [Comments]                          -> [Comments]                         
Host1: folder [Comments] has 0 messages in total (mentioned by SELECT)
Host2: folder [Comments] has 0 messages in total (mentioned by SELECT)
Host2: folder [Comments] permanentflags: 
Host1: folder [Comments] considering 0 messages
Host2: folder [Comments] considering 0 messages
Host1: folder [Comments] selected 0 messages, duplicates 0
Host2: folder [Comments] selected 0 messages, duplicates 0
ETA: sábado 26 agosto 2023-08-26 17:49:01 -0400 CDT  8 s  534/534 msgs left
Folder     2/7 [Drafts]                            -> [Drafts]                           
Host1: folder [Drafts] has 0 messages in total (mentioned by SELECT)
Host2: folder [Drafts] has 0 messages in total (mentioned by SELECT)
Host2: folder [Drafts] permanentflags: 
Host1: folder [Drafts] considering 0 messages
Host2: folder [Drafts] considering 0 messages
Host1: folder [Drafts] selected 0 messages, duplicates 0
Host2: folder [Drafts] selected 0 messages, duplicates 0
ETA: sábado 26 agosto 2023-08-26 17:49:08 -0400 CDT  14 s  534/534 msgs left
Folder     3/7 [INBOX]                             -> [INBOX]                            
Host1: folder [INBOX] has 33 messages in total (mentioned by SELECT)
Host2: folder [INBOX] has 0 messages in total (mentioned by SELECT)
Host2: folder [INBOX] permanentflags: 
Host1: folder [INBOX] considering 33 messages
Host2: folder [INBOX] considering 0 messages
Host1: folder [INBOX] selected 33 messages, duplicates 0
Host2: folder [INBOX] selected 0 messages, duplicates 0
msg INBOX/1202 {2531}         copied to INBOX/861        4.41 msgs/s  10.906 KiB/s 2.472 KiB copied ETA: sábado 26 agosto 2023-08-26 17:50:55 -0400 CDT  121 s  533/534 msgs left
msg INBOX/1226 {6254}         copied to INBOX/862        6.98 msgs/s  29.940 KiB/s 8.579 KiB copied ETA: sábado 26 agosto 2023-08-26 17:50:10 -0400 CDT  76 s  532/534 msgs left
msg INBOX/1240 {2749}         copied to INBOX/863        8.69 msgs/s  32.610 KiB/s 11.264 KiB copied ETA: sábado 26 agosto 2023-08-26 17:49:55 -0400 CDT  61 s  531/534 msgs left
msg INBOX/1260 {44726}        copied to INBOX/864        9.60 msgs/s  131.801 KiB/s 54.941 KiB copied ETA: sábado 26 agosto 2023-08-26 17:49:49 -0400 CDT  55 s  530/534 msgs left
msg INBOX/1261 {6396}         copied to INBOX/865        10.27 msgs/s  125.723 KiB/s 61.188 KiB copied ETA: sábado 26 agosto 2023-08-26 17:49:45 -0400 CDT  52 s  529/534 msgs left
msg INBOX/1282 {5412}         copied to INBOX/866        10.95 msgs/s  121.345 KiB/s 66.473 KiB copied ETA: sábado 26 agosto 2023-08-26 17:49:42 -0400 CDT  48 s  528/534 msgs left
msg INBOX/1283 {33305}        copied to INBOX/867        11.34 msgs/s  160.388 KiB/s 98.997 KiB copied ETA: sábado 26 agosto 2023-08-26 17:49:40 -0400 CDT  47 s  527/534 msgs left
msg INBOX/1284 {8538}         copied to INBOX/868        11.89 msgs/s  159.493 KiB/s 107.335 KiB copied ETA: sábado 26 agosto 2023-08-26 17:49:38 -0400 CDT  44 s  526/534 msgs left
msg INBOX/1285 {10393}        copied to INBOX/869        12.07 msgs/s  157.610 KiB/s 117.484 KiB copied ETA: sábado 26 agosto 2023-08-26 17:49:37 -0400 CDT  44 s  525/534 msgs left
msg INBOX/1286 {759865}       copied to INBOX/870        10.68 msgs/s  918.177 KiB/s 859.540 KiB copied ETA: sábado 26 agosto 2023-08-26 17:49:43 -0400 CDT  49 s  524/534 msgs left
msg INBOX/1287 {5874}         copied to INBOX/871        11.59 msgs/s  911.777 KiB/s 865.276 KiB copied ETA: sábado 26 agosto 2023-08-26 17:49:39 -0400 CDT  45 s  523/534 msgs left
msg INBOX/1300 {2171}         copied to INBOX/872        11.98 msgs/s  866.253 KiB/s 867.396 KiB copied ETA: sábado 26 agosto 2023-08-26 17:49:38 -0400 CDT  44 s  522/534 msgs left
msg INBOX/1320 {21729}        copied to INBOX/873        12.25 msgs/s  837.149 KiB/s 888.616 KiB copied ETA: sábado 26 agosto 2023-08-26 17:49:37 -0400 CDT  43 s  521/534 msgs left
msg INBOX/1342 {8026}         copied to INBOX/874        12.40 msgs/s  794.099 KiB/s 896.454 KiB copied ETA: sábado 26 agosto 2023-08-26 17:49:36 -0400 CDT  42 s  520/534 msgs left
msg INBOX/1345 {6299}         copied to INBOX/875        12.56 msgs/s  755.564 KiB/s 902.605 KiB copied ETA: sábado 26 agosto 2023-08-26 17:49:36 -0400 CDT  41 s  519/534 msgs left
msg INBOX/1360 {7820}         copied to INBOX/876        12.79 msgs/s  727.504 KiB/s 910.242 KiB copied ETA: sábado 26 agosto 2023-08-26 17:49:35 -0400 CDT  41 s  518/534 msgs left
msg INBOX/1401 {5702}         copied to INBOX/877        13.02 msgs/s  701.531 KiB/s 915.811 KiB copied ETA: sábado 26 agosto 2023-08-26 17:49:34 -0400 CDT  40 s  517/534 msgs left
msg INBOX/1421 {1782}         copied to INBOX/878        13.22 msgs/s  673.793 KiB/s 917.551 KiB copied ETA: sábado 26 agosto 2023-08-26 17:49:34 -0400 CDT  39 s  516/534 msgs left
msg INBOX/1424 {845895}       copied to INBOX/879        12.17 msgs/s  1.090 MiB/s 1.703 MiB copied ETA: sábado 26 agosto 2023-08-26 17:49:37 -0400 CDT  42 s  515/534 msgs left
msg INBOX/1425 {6368}         copied to INBOX/880        12.69 msgs/s  1.084 MiB/s 1.709 MiB copied ETA: sábado 26 agosto 2023-08-26 17:49:35 -0400 CDT  41 s  514/534 msgs left
msg INBOX/1426 {2411346}      copied to INBOX/881        10.00 msgs/s  1.909 MiB/s 4.008 MiB copied ETA: sábado 26 agosto 2023-08-26 17:49:47 -0400 CDT  51 s  513/534 msgs left
msg INBOX/1427 {7587}         copied to INBOX/882        10.20 msgs/s  1.862 MiB/s 4.016 MiB copied ETA: sábado 26 agosto 2023-08-26 17:49:46 -0400 CDT  50 s  512/534 msgs left
msg INBOX/1428 {6469}         copied to INBOX/883        10.36 msgs/s  1.812 MiB/s 4.022 MiB copied ETA: sábado 26 agosto 2023-08-26 17:49:45 -0400 CDT  49 s  511/534 msgs left
msg INBOX/1429 {6339}         copied to INBOX/884        10.52 msgs/s  1.765 MiB/s 4.028 MiB copied ETA: sábado 26 agosto 2023-08-26 17:49:44 -0400 CDT  49 s  510/534 msgs left
msg INBOX/1430 {31483}        copied to INBOX/885        10.64 msgs/s  1.727 MiB/s 4.058 MiB copied ETA: sábado 26 agosto 2023-08-26 17:49:43 -0400 CDT  48 s  509/534 msgs left
msg INBOX/1441 {1657}         copied to INBOX/886        10.80 msgs/s  1.686 MiB/s 4.060 MiB copied ETA: sábado 26 agosto 2023-08-26 17:49:43 -0400 CDT  47 s  508/534 msgs left
msg INBOX/1443 {40711}        copied to INBOX/887        10.92 msgs/s  1.657 MiB/s 4.098 MiB copied ETA: sábado 26 agosto 2023-08-26 17:49:42 -0400 CDT  46 s  507/534 msgs left
msg INBOX/1444 {30539}        copied to INBOX/888        11.05 msgs/s  1.629 MiB/s 4.127 MiB copied ETA: sábado 26 agosto 2023-08-26 17:49:41 -0400 CDT  46 s  506/534 msgs left
msg INBOX/1445 {31026}        copied to INBOX/889        11.19 msgs/s  1.604 MiB/s 4.157 MiB copied ETA: sábado 26 agosto 2023-08-26 17:49:41 -0400 CDT  45 s  505/534 msgs left
msg INBOX/1446 {284101}       copied to INBOX/890        11.20 msgs/s  1.653 MiB/s 4.428 MiB copied ETA: sábado 26 agosto 2023-08-26 17:49:41 -0400 CDT  45 s  504/534 msgs left
msg INBOX/1460 {30051}        copied to INBOX/891        11.45 msgs/s  1.646 MiB/s 4.457 MiB copied ETA: sábado 26 agosto 2023-08-26 17:49:40 -0400 CDT  44 s  503/534 msgs left
msg INBOX/1461 {38397}        copied to INBOX/892        11.54 msgs/s  1.620 MiB/s 4.493 MiB copied ETA: sábado 26 agosto 2023-08-26 17:49:39 -0400 CDT  44 s  502/534 msgs left
msg INBOX/1462 {2268}         copied to INBOX/893        11.66 msgs/s  1.588 MiB/s 4.495 MiB copied ETA: sábado 26 agosto 2023-08-26 17:49:39 -0400 CDT  43 s  501/534 msgs left
ETA: sábado 26 agosto 2023-08-26 17:49:39 -0400 CDT  43 s  501/534 msgs left
Folder     4/7 [Junk]                              -> [Junk]                             
Host1: folder [Junk] has 0 messages in total (mentioned by SELECT)
Host2: folder [Junk] has 0 messages in total (mentioned by SELECT)
Host2: folder [Junk] permanentflags: 
Host1: folder [Junk] considering 0 messages
Host2: folder [Junk] considering 0 messages
Host1: folder [Junk] selected 0 messages, duplicates 0
Host2: folder [Junk] selected 0 messages, duplicates 0
ETA: sábado 26 agosto 2023-08-26 17:49:39 -0400 CDT  43 s  501/534 msgs left
Folder     5/7 [Notes]                             -> [Notes]                            
Host1: folder [Notes] has 0 messages in total (mentioned by SELECT)
Host2: folder [Notes] has 0 messages in total (mentioned by SELECT)
Host2: folder [Notes] permanentflags: 
Host1: folder [Notes] considering 0 messages
Host2: folder [Notes] considering 0 messages
Host1: folder [Notes] selected 0 messages, duplicates 0
Host2: folder [Notes] selected 0 messages, duplicates 0
ETA: sábado 26 agosto 2023-08-26 17:49:39 -0400 CDT  43 s  501/534 msgs left
Folder     6/7 [Sent]                              -> [Sent]                             
Host1: folder [Sent] has 189 messages in total (mentioned by SELECT)
Host2: folder [Sent] has 0 messages in total (mentioned by SELECT)
Host2: folder [Sent] permanentflags: 
Host1: folder [Sent] considering 189 messages
Host2: folder [Sent] considering 0 messages
Host1: folder [Sent] selected 189 messages, duplicates 0
Host2: folder [Sent] selected 0 messages, duplicates 0
msg Sent/259 {1105}          copied to Sent/209        10.96 msgs/s  1.450 MiB/s 4.496 MiB copied ETA: sábado 26 agosto 2023-08-26 17:49:42 -0400 CDT  46 s  500/534 msgs left
msg Sent/261 {976}           copied to Sent/210        11.09 msgs/s  1.426 MiB/s 4.497 MiB copied ETA: sábado 26 agosto 2023-08-26 17:49:41 -0400 CDT  45 s  499/534 msgs left
msg Sent/263 {966}           copied to Sent/211        11.23 msgs/s  1.403 MiB/s 4.498 MiB copied ETA: sábado 26 agosto 2023-08-26 17:49:41 -0400 CDT  44 s  498/534 msgs left
msg Sent/265 {1077}          copied to Sent/212        11.34 msgs/s  1.378 MiB/s 4.499 MiB copied ETA: sábado 26 agosto 2023-08-26 17:49:40 -0400 CDT  44 s  497/534 msgs left
msg Sent/267 {966}           copied to Sent/213        11.44 msgs/s  1.355 MiB/s 4.500 MiB copied ETA: sábado 26 agosto 2023-08-26 17:49:40 -0400 CDT  43 s  496/534 msgs left
msg Sent/268 {1487}          copied to Sent/214        11.55 msgs/s  1.333 MiB/s 4.502 MiB copied ETA: sábado 26 agosto 2023-08-26 17:49:39 -0400 CDT  43 s  495/534 msgs left
msg Sent/269 {790533}        copied to Sent/215        11.23 msgs/s  1.476 MiB/s 5.256 MiB copied ETA: sábado 26 agosto 2023-08-26 17:49:41 -0400 CDT  44 s  494/534 msgs left
msg Sent/270 {790570}        copied to Sent/216        11.03 msgs/s  1.617 MiB/s 6.010 MiB copied ETA: sábado 26 agosto 2023-08-26 17:49:42 -0400 CDT  45 s  493/534 msgs left
msg Sent/271 {790549}        copied to Sent/217        10.82 msgs/s  1.742 MiB/s 6.763 MiB copied ETA: sábado 26 agosto 2023-08-26 17:49:43 -0400 CDT  45 s  492/534 msgs left
msg Sent/272 {790560}        copied to Sent/218        10.65 msgs/s  1.862 MiB/s 7.517 MiB copied ETA: sábado 26 agosto 2023-08-26 17:49:43 -0400 CDT  46 s  491/534 msgs left
msg Sent/273 {790525}        copied to Sent/219        10.43 msgs/s  1.962 MiB/s 8.271 MiB copied ETA: sábado 26 agosto 2023-08-26 17:49:44 -0400 CDT  47 s  490/534 msgs left
msg Sent/274 {790526}        copied to Sent/220        10.29 msgs/s  2.063 MiB/s 9.025 MiB copied ETA: sábado 26 agosto 2023-08-26 17:49:45 -0400 CDT  48 s  489/534 msgs left
msg Sent/275 {790526}        copied to Sent/221        10.17 msgs/s  2.162 MiB/s 9.779 MiB copied ETA: sábado 26 agosto 2023-08-26 17:49:46 -0400 CDT  48 s  488/534 msgs left
msg Sent/276 {790513}        copied to Sent/222        10.04 msgs/s  2.249 MiB/s 10.533 MiB copied ETA: sábado 26 agosto 2023-08-26 17:49:46 -0400 CDT  49 s  487/534 msgs left
msg Sent/277 {790537}        copied to Sent/223        9.91 msgs/s  2.331 MiB/s 11.287 MiB copied ETA: sábado 26 agosto 2023-08-26 17:49:47 -0400 CDT  49 s  486/534 msgs left
msg Sent/278 {944}           copied to Sent/224        10.01 msgs/s  2.307 MiB/s 11.288 MiB copied ETA: sábado 26 agosto 2023-08-26 17:49:46 -0400 CDT  48 s  485/534 msgs left
msg Sent/280 {790542}        copied to Sent/225        9.91 msgs/s  2.388 MiB/s 12.042 MiB copied ETA: sábado 26 agosto 2023-08-26 17:49:47 -0400 CDT  49 s  484/534 msgs left
msg Sent/281 {790527}        copied to Sent/226        9.79 msgs/s  2.456 MiB/s 12.796 MiB copied ETA: sábado 26 agosto 2023-08-26 17:49:48 -0400 CDT  49 s  483/534 msgs left
msg Sent/282 {675099}        copied to Sent/227        9.72 msgs/s  2.513 MiB/s 13.439 MiB copied ETA: sábado 26 agosto 2023-08-26 17:49:48 -0400 CDT  50 s  482/534 msgs left
msg Sent/284 {986684}        copied to Sent/228        9.54 msgs/s  2.588 MiB/s 14.380 MiB copied ETA: sábado 26 agosto 2023-08-26 17:49:49 -0400 CDT  50 s  481/534 msgs left
msg Sent/291 {1026}          copied to Sent/229        9.70 msgs/s  2.583 MiB/s 14.381 MiB copied ETA: sábado 26 agosto 2023-08-26 17:49:48 -0400 CDT  49 s  480/534 msgs left
msg Sent/298 {983}           copied to Sent/230        9.78 msgs/s  2.558 MiB/s 14.382 MiB copied ETA: sábado 26 agosto 2023-08-26 17:49:48 -0400 CDT  49 s  479/534 msgs left
msg Sent/299 {29597}         copied to Sent/231        9.85 msgs/s  2.535 MiB/s 14.411 MiB copied ETA: sábado 26 agosto 2023-08-26 17:49:47 -0400 CDT  49 s  478/534 msgs left
msg Sent/300 {16815}         copied to Sent/232        9.93 msgs/s  2.513 MiB/s 14.427 MiB copied ETA: sábado 26 agosto 2023-08-26 17:49:47 -0400 CDT  48 s  477/534 msgs left
msg Sent/302 {992}           copied to Sent/233        10.00 msgs/s  2.487 MiB/s 14.428 MiB copied ETA: sábado 26 agosto 2023-08-26 17:49:47 -0400 CDT  48 s  476/534 msgs left
msg Sent/322 {957}           copied to Sent/234        10.06 msgs/s  2.460 MiB/s 14.429 MiB copied ETA: sábado 26 agosto 2023-08-26 17:49:46 -0400 CDT  47 s  475/534 msgs left
msg Sent/323 {1006}          copied to Sent/235        10.12 msgs/s  2.434 MiB/s 14.429 MiB copied ETA: sábado 26 agosto 2023-08-26 17:49:46 -0400 CDT  47 s  474/534 msgs left
msg Sent/325 {1028}          copied to Sent/236        10.18 msgs/s  2.409 MiB/s 14.430 MiB copied ETA: sábado 26 agosto 2023-08-26 17:49:46 -0400 CDT  46 s  473/534 msgs left
msg Sent/326 {960}           copied to Sent/237        10.23 msgs/s  2.381 MiB/s 14.431 MiB copied ETA: sábado 26 agosto 2023-08-26 17:49:45 -0400 CDT  46 s  472/534 msgs left
msg Sent/328 {967}           copied to Sent/238        10.29 msgs/s  2.356 MiB/s 14.432 MiB copied ETA: sábado 26 agosto 2023-08-26 17:49:45 -0400 CDT  46 s  471/534 msgs left
msg Sent/330 {955}           copied to Sent/239        10.35 msgs/s  2.333 MiB/s 14.433 MiB copied ETA: sábado 26 agosto 2023-08-26 17:49:45 -0400 CDT  45 s  470/534 msgs left
msg Sent/332 {955}           copied to Sent/240        10.41 msgs/s  2.311 MiB/s 14.434 MiB copied ETA: sábado 26 agosto 2023-08-26 17:49:44 -0400 CDT  45 s  469/534 msgs left
msg Sent/334 {967}           copied to Sent/241        10.45 msgs/s  2.286 MiB/s 14.435 MiB copied ETA: sábado 26 agosto 2023-08-26 17:49:44 -0400 CDT  45 s  468/534 msgs left
msg Sent/336 {958}           copied to Sent/242        10.51 msgs/s  2.264 MiB/s 14.436 MiB copied ETA: sábado 26 agosto 2023-08-26 17:49:44 -0400 CDT  44 s  467/534 msgs left
msg Sent/338 {966}           copied to Sent/243        10.57 msgs/s  2.243 MiB/s 14.437 MiB copied ETA: sábado 26 agosto 2023-08-26 17:49:44 -0400 CDT  44 s  466/534 msgs left
msg Sent/340 {994}           copied to Sent/244        10.62 msgs/s  2.222 MiB/s 14.438 MiB copied ETA: sábado 26 agosto 2023-08-26 17:49:43 -0400 CDT  44 s  465/534 msgs left
msg Sent/341 {966}           copied to Sent/245        10.67 msgs/s  2.200 MiB/s 14.439 MiB copied ETA: sábado 26 agosto 2023-08-26 17:49:43 -0400 CDT  44 s  464/534 msgs left
msg Sent/343 {954}           copied to Sent/246        10.72 msgs/s  2.180 MiB/s 14.440 MiB copied ETA: sábado 26 agosto 2023-08-26 17:49:43 -0400 CDT  43 s  463/534 msgs left
msg Sent/345 {995}           copied to Sent/247        10.78 msgs/s  2.162 MiB/s 14.441 MiB copied ETA: sábado 26 agosto 2023-08-26 17:49:43 -0400 CDT  43 s  462/534 msgs left
msg Sent/346 {975}           copied to Sent/248        10.84 msgs/s  2.144 MiB/s 14.442 MiB copied ETA: sábado 26 agosto 2023-08-26 17:49:42 -0400 CDT  43 s  461/534 msgs left
msg Sent/347 {976}           copied to Sent/249        10.90 msgs/s  2.127 MiB/s 14.442 MiB copied ETA: sábado 26 agosto 2023-08-26 17:49:42 -0400 CDT  42 s  460/534 msgs left
msg Sent/348 {996}           copied to Sent/250        10.94 msgs/s  2.107 MiB/s 14.443 MiB copied ETA: sábado 26 agosto 2023-08-26 17:49:42 -0400 CDT  42 s  459/534 msgs left
msg Sent/349 {928}           copied to Sent/251        11.00 msgs/s  2.090 MiB/s 14.444 MiB copied ETA: sábado 26 agosto 2023-08-26 17:49:42 -0400 CDT  42 s  458/534 msgs left
msg Sent/352 {933}           copied to Sent/252        11.06 msgs/s  2.075 MiB/s 14.445 MiB copied ETA: sábado 26 agosto 2023-08-26 17:49:41 -0400 CDT  41 s  457/534 msgs left
msg Sent/355 {924}           copied to Sent/253        11.12 msgs/s  2.060 MiB/s 14.446 MiB copied ETA: sábado 26 agosto 2023-08-26 17:49:41 -0400 CDT  41 s  456/534 msgs left
msg Sent/358 {971}           copied to Sent/254        11.17 msgs/s  2.043 MiB/s 14.447 MiB copied ETA: sábado 26 agosto 2023-08-26 17:49:41 -0400 CDT  41 s  455/534 msgs left
msg Sent/360 {926}           copied to Sent/255        11.23 msgs/s  2.028 MiB/s 14.448 MiB copied ETA: sábado 26 agosto 2023-08-26 17:49:41 -0400 CDT  40 s  454/534 msgs left
msg Sent/362 {959}           copied to Sent/256        11.27 msgs/s  2.011 MiB/s 14.449 MiB copied ETA: sábado 26 agosto 2023-08-26 17:49:41 -0400 CDT  40 s  453/534 msgs left
msg Sent/364 {969}           copied to Sent/257        11.31 msgs/s  1.993 MiB/s 14.450 MiB copied ETA: sábado 26 agosto 2023-08-26 17:49:40 -0400 CDT  40 s  452/534 msgs left
msg Sent/366 {965}           copied to Sent/258        11.35 msgs/s  1.977 MiB/s 14.451 MiB copied ETA: sábado 26 agosto 2023-08-26 17:49:40 -0400 CDT  40 s  451/534 msgs left
msg Sent/370 {959}           copied to Sent/259        11.39 msgs/s  1.960 MiB/s 14.452 MiB copied ETA: sábado 26 agosto 2023-08-26 17:49:40 -0400 CDT  40 s  450/534 msgs left
msg Sent/376 {978}           copied to Sent/260        11.43 msgs/s  1.943 MiB/s 14.452 MiB copied ETA: sábado 26 agosto 2023-08-26 17:49:40 -0400 CDT  39 s  449/534 msgs left
msg Sent/385 {19103}         copied to Sent/261        11.47 msgs/s  1.930 MiB/s 14.471 MiB copied ETA: sábado 26 agosto 2023-08-26 17:49:40 -0400 CDT  39 s  448/534 msgs left
msg Sent/388 {983}           copied to Sent/262        11.51 msgs/s  1.914 MiB/s 14.472 MiB copied ETA: sábado 26 agosto 2023-08-26 17:49:40 -0400 CDT  39 s  447/534 msgs left
msg Sent/390 {932}           copied to Sent/263        11.56 msgs/s  1.901 MiB/s 14.473 MiB copied ETA: sábado 26 agosto 2023-08-26 17:49:39 -0400 CDT  39 s  446/534 msgs left
msg Sent/392 {960}           copied to Sent/264        11.61 msgs/s  1.887 MiB/s 14.473 MiB copied ETA: sábado 26 agosto 2023-08-26 17:49:39 -0400 CDT  38 s  445/534 msgs left
msg Sent/394 {955}           copied to Sent/265        11.66 msgs/s  1.875 MiB/s 14.474 MiB copied ETA: sábado 26 agosto 2023-08-26 17:49:39 -0400 CDT  38 s  444/534 msgs left
msg Sent/395 {998}           copied to Sent/266        11.70 msgs/s  1.861 MiB/s 14.475 MiB copied ETA: sábado 26 agosto 2023-08-26 17:49:39 -0400 CDT  38 s  443/534 msgs left
msg Sent/398 {954}           copied to Sent/267        11.72 msgs/s  1.844 MiB/s 14.476 MiB copied ETA: sábado 26 agosto 2023-08-26 17:49:39 -0400 CDT  38 s  442/534 msgs left
msg Sent/400 {1430}          copied to Sent/268        11.75 msgs/s  1.829 MiB/s 14.478 MiB copied ETA: sábado 26 agosto 2023-08-26 17:49:39 -0400 CDT  38 s  441/534 msgs left
msg Sent/402 {971}           copied to Sent/269        11.79 msgs/s  1.816 MiB/s 14.478 MiB copied ETA: sábado 26 agosto 2023-08-26 17:49:38 -0400 CDT  37 s  440/534 msgs left
msg Sent/409 {953}           copied to Sent/270        11.83 msgs/s  1.803 MiB/s 14.479 MiB copied ETA: sábado 26 agosto 2023-08-26 17:49:38 -0400 CDT  37 s  439/534 msgs left
msg Sent/411 {951}           copied to Sent/271        11.86 msgs/s  1.789 MiB/s 14.480 MiB copied ETA: sábado 26 agosto 2023-08-26 17:49:38 -0400 CDT  37 s  438/534 msgs left
msg Sent/414 {971}           copied to Sent/272        11.89 msgs/s  1.774 MiB/s 14.481 MiB copied ETA: sábado 26 agosto 2023-08-26 17:49:38 -0400 CDT  37 s  437/534 msgs left
msg Sent/415 {934}           copied to Sent/273        11.92 msgs/s  1.761 MiB/s 14.482 MiB copied ETA: sábado 26 agosto 2023-08-26 17:49:38 -0400 CDT  37 s  436/534 msgs left
msg Sent/417 {937}           copied to Sent/274        11.95 msgs/s  1.748 MiB/s 14.483 MiB copied ETA: sábado 26 agosto 2023-08-26 17:49:38 -0400 CDT  36 s  435/534 msgs left
msg Sent/418 {959}           copied to Sent/275        11.99 msgs/s  1.737 MiB/s 14.484 MiB copied ETA: sábado 26 agosto 2023-08-26 17:49:38 -0400 CDT  36 s  434/534 msgs left
msg Sent/421 {4898722}       copied to Sent/276        10.87 msgs/s  2.061 MiB/s 19.156 MiB copied ETA: sábado 26 agosto 2023-08-26 17:49:42 -0400 CDT  40 s  433/534 msgs left
msg Sent/422 {961}           copied to Sent/277        10.91 msgs/s  2.048 MiB/s 19.157 MiB copied ETA: sábado 26 agosto 2023-08-26 17:49:42 -0400 CDT  40 s  432/534 msgs left
msg Sent/428 {502}           copied to Sent/278        10.95 msgs/s  2.036 MiB/s 19.157 MiB copied ETA: sábado 26 agosto 2023-08-26 17:49:42 -0400 CDT  39 s  431/534 msgs left
msg Sent/435 {961}           copied to Sent/279        10.98 msgs/s  2.023 MiB/s 19.158 MiB copied ETA: sábado 26 agosto 2023-08-26 17:49:42 -0400 CDT  39 s  430/534 msgs left
msg Sent/436 {947}           copied to Sent/280        11.02 msgs/s  2.010 MiB/s 19.159 MiB copied ETA: sábado 26 agosto 2023-08-26 17:49:42 -0400 CDT  39 s  429/534 msgs left
msg Sent/438 {951}           copied to Sent/281        11.05 msgs/s  1.997 MiB/s 19.160 MiB copied ETA: sábado 26 agosto 2023-08-26 17:49:41 -0400 CDT  39 s  428/534 msgs left
msg Sent/440 {971}           copied to Sent/282        11.08 msgs/s  1.985 MiB/s 19.161 MiB copied ETA: sábado 26 agosto 2023-08-26 17:49:41 -0400 CDT  39 s  427/534 msgs left
msg Sent/442 {972}           copied to Sent/283        11.12 msgs/s  1.973 MiB/s 19.162 MiB copied ETA: sábado 26 agosto 2023-08-26 17:49:41 -0400 CDT  38 s  426/534 msgs left
msg Sent/443 {967}           copied to Sent/284        11.15 msgs/s  1.961 MiB/s 19.163 MiB copied ETA: sábado 26 agosto 2023-08-26 17:49:41 -0400 CDT  38 s  425/534 msgs left
msg Sent/444 {972}           copied to Sent/285        11.19 msgs/s  1.950 MiB/s 19.164 MiB copied ETA: sábado 26 agosto 2023-08-26 17:49:41 -0400 CDT  38 s  424/534 msgs left
msg Sent/445 {952}           copied to Sent/286        11.23 msgs/s  1.938 MiB/s 19.164 MiB copied ETA: sábado 26 agosto 2023-08-26 17:49:41 -0400 CDT  38 s  423/534 msgs left
msg Sent/447 {966}           copied to Sent/287        11.26 msgs/s  1.926 MiB/s 19.165 MiB copied ETA: sábado 26 agosto 2023-08-26 17:49:41 -0400 CDT  37 s  422/534 msgs left
msg Sent/449 {973}           copied to Sent/288        11.29 msgs/s  1.915 MiB/s 19.166 MiB copied ETA: sábado 26 agosto 2023-08-26 17:49:40 -0400 CDT  37 s  421/534 msgs left
msg Sent/453 {212491}        copied to Sent/289        11.30 msgs/s  1.920 MiB/s 19.369 MiB copied ETA: sábado 26 agosto 2023-08-26 17:49:40 -0400 CDT  37 s  420/534 msgs left
msg Sent/456 {957}           copied to Sent/290        11.33 msgs/s  1.908 MiB/s 19.370 MiB copied ETA: sábado 26 agosto 2023-08-26 17:49:40 -0400 CDT  37 s  419/534 msgs left
msg Sent/464 {956}           copied to Sent/291        11.36 msgs/s  1.897 MiB/s 19.371 MiB copied ETA: sábado 26 agosto 2023-08-26 17:49:40 -0400 CDT  37 s  418/534 msgs left
msg Sent/466 {951}           copied to Sent/292        11.39 msgs/s  1.886 MiB/s 19.372 MiB copied ETA: sábado 26 agosto 2023-08-26 17:49:40 -0400 CDT  37 s  417/534 msgs left
msg Sent/469 {941}           copied to Sent/293        11.42 msgs/s  1.875 MiB/s 19.373 MiB copied ETA: sábado 26 agosto 2023-08-26 17:49:40 -0400 CDT  36 s  416/534 msgs left
msg Sent/471 {975}           copied to Sent/294        11.46 msgs/s  1.865 MiB/s 19.374 MiB copied ETA: sábado 26 agosto 2023-08-26 17:49:40 -0400 CDT  36 s  415/534 msgs left
msg Sent/475 {939}           copied to Sent/295        11.49 msgs/s  1.855 MiB/s 19.374 MiB copied ETA: sábado 26 agosto 2023-08-26 17:49:40 -0400 CDT  36 s  414/534 msgs left
msg Sent/477 {1116}          copied to Sent/296        11.51 msgs/s  1.844 MiB/s 19.375 MiB copied ETA: sábado 26 agosto 2023-08-26 17:49:40 -0400 CDT  36 s  413/534 msgs left
msg Sent/480 {1029}          copied to Sent/297        11.55 msgs/s  1.834 MiB/s 19.376 MiB copied ETA: sábado 26 agosto 2023-08-26 17:49:39 -0400 CDT  36 s  412/534 msgs left
msg Sent/482 {1067}          copied to Sent/298        11.57 msgs/s  1.823 MiB/s 19.377 MiB copied ETA: sábado 26 agosto 2023-08-26 17:49:39 -0400 CDT  36 s  411/534 msgs left
msg Sent/484 {961}           copied to Sent/299        11.59 msgs/s  1.812 MiB/s 19.378 MiB copied ETA: sábado 26 agosto 2023-08-26 17:49:39 -0400 CDT  35 s  410/534 msgs left
msg Sent/487 {954}           copied to Sent/300        11.62 msgs/s  1.801 MiB/s 19.379 MiB copied ETA: sábado 26 agosto 2023-08-26 17:49:39 -0400 CDT  35 s  409/534 msgs left
msg Sent/489 {935}           copied to Sent/301        11.65 msgs/s  1.791 MiB/s 19.380 MiB copied ETA: sábado 26 agosto 2023-08-26 17:49:39 -0400 CDT  35 s  408/534 msgs left
msg Sent/492 {946}           copied to Sent/302        11.68 msgs/s  1.782 MiB/s 19.381 MiB copied ETA: sábado 26 agosto 2023-08-26 17:49:39 -0400 CDT  35 s  407/534 msgs left
msg Sent/494 {963}           copied to Sent/303        11.71 msgs/s  1.773 MiB/s 19.382 MiB copied ETA: sábado 26 agosto 2023-08-26 17:49:39 -0400 CDT  35 s  406/534 msgs left
msg Sent/496 {949}           copied to Sent/304        11.73 msgs/s  1.763 MiB/s 19.383 MiB copied ETA: sábado 26 agosto 2023-08-26 17:49:39 -0400 CDT  35 s  405/534 msgs left
msg Sent/503 {967}           copied to Sent/305        11.76 msgs/s  1.754 MiB/s 19.384 MiB copied ETA: sábado 26 agosto 2023-08-26 17:49:39 -0400 CDT  34 s  404/534 msgs left
msg Sent/505 {980}           copied to Sent/306        11.79 msgs/s  1.744 MiB/s 19.385 MiB copied ETA: sábado 26 agosto 2023-08-26 17:49:38 -0400 CDT  34 s  403/534 msgs left
msg Sent/507 {952}           copied to Sent/307        11.81 msgs/s  1.735 MiB/s 19.386 MiB copied ETA: sábado 26 agosto 2023-08-26 17:49:38 -0400 CDT  34 s  402/534 msgs left
msg Sent/517 {930}           copied to Sent/308        11.84 msgs/s  1.726 MiB/s 19.387 MiB copied ETA: sábado 26 agosto 2023-08-26 17:49:38 -0400 CDT  34 s  401/534 msgs left
msg Sent/520 {953}           copied to Sent/309        11.87 msgs/s  1.717 MiB/s 19.387 MiB copied ETA: sábado 26 agosto 2023-08-26 17:49:38 -0400 CDT  34 s  400/534 msgs left
msg Sent/523 {948}           copied to Sent/310        11.89 msgs/s  1.708 MiB/s 19.388 MiB copied ETA: sábado 26 agosto 2023-08-26 17:49:38 -0400 CDT  34 s  399/534 msgs left
msg Sent/525 {943}           copied to Sent/311        11.92 msgs/s  1.699 MiB/s 19.389 MiB copied ETA: sábado 26 agosto 2023-08-26 17:49:38 -0400 CDT  33 s  398/534 msgs left
msg Sent/527 {1136}          copied to Sent/312        11.94 msgs/s  1.690 MiB/s 19.390 MiB copied ETA: sábado 26 agosto 2023-08-26 17:49:38 -0400 CDT  33 s  397/534 msgs left
msg Sent/528 {999}           copied to Sent/313        11.96 msgs/s  1.681 MiB/s 19.391 MiB copied ETA: sábado 26 agosto 2023-08-26 17:49:38 -0400 CDT  33 s  396/534 msgs left
msg Sent/530 {1121}          copied to Sent/314        11.99 msgs/s  1.673 MiB/s 19.392 MiB copied ETA: sábado 26 agosto 2023-08-26 17:49:38 -0400 CDT  33 s  395/534 msgs left
msg Sent/531 {1100}          copied to Sent/315        12.02 msgs/s  1.665 MiB/s 19.393 MiB copied ETA: sábado 26 agosto 2023-08-26 17:49:38 -0400 CDT  33 s  394/534 msgs left
msg Sent/533 {3464}          copied to Sent/316        12.05 msgs/s  1.658 MiB/s 19.397 MiB copied ETA: sábado 26 agosto 2023-08-26 17:49:37 -0400 CDT  33 s  393/534 msgs left
msg Sent/534 {944}           copied to Sent/317        12.08 msgs/s  1.650 MiB/s 19.398 MiB copied ETA: sábado 26 agosto 2023-08-26 17:49:37 -0400 CDT  32 s  392/534 msgs left
msg Sent/535 {952}           copied to Sent/318        12.11 msgs/s  1.643 MiB/s 19.399 MiB copied ETA: sábado 26 agosto 2023-08-26 17:49:37 -0400 CDT  32 s  391/534 msgs left
msg Sent/536 {987}           copied to Sent/319        12.13 msgs/s  1.634 MiB/s 19.399 MiB copied ETA: sábado 26 agosto 2023-08-26 17:49:37 -0400 CDT  32 s  390/534 msgs left
msg Sent/537 {1020}          copied to Sent/320        12.15 msgs/s  1.625 MiB/s 19.400 MiB copied ETA: sábado 26 agosto 2023-08-26 17:49:37 -0400 CDT  32 s  389/534 msgs left
msg Sent/538 {1017}          copied to Sent/321        12.17 msgs/s  1.617 MiB/s 19.401 MiB copied ETA: sábado 26 agosto 2023-08-26 17:49:37 -0400 CDT  32 s  388/534 msgs left
msg Sent/539 {943}           copied to Sent/322        12.20 msgs/s  1.610 MiB/s 19.402 MiB copied ETA: sábado 26 agosto 2023-08-26 17:49:37 -0400 CDT  32 s  387/534 msgs left
msg Sent/540 {968}           copied to Sent/323        12.22 msgs/s  1.603 MiB/s 19.403 MiB copied ETA: sábado 26 agosto 2023-08-26 17:49:37 -0400 CDT  32 s  386/534 msgs left
msg Sent/541 {1004}          copied to Sent/324        12.25 msgs/s  1.595 MiB/s 19.404 MiB copied ETA: sábado 26 agosto 2023-08-26 17:49:37 -0400 CDT  31 s  385/534 msgs left
msg Sent/542 {1144}          copied to Sent/325        12.26 msgs/s  1.587 MiB/s 19.405 MiB copied ETA: sábado 26 agosto 2023-08-26 17:49:37 -0400 CDT  31 s  384/534 msgs left
msg Sent/544 {1085}          copied to Sent/326        12.28 msgs/s  1.578 MiB/s 19.406 MiB copied ETA: sábado 26 agosto 2023-08-26 17:49:37 -0400 CDT  31 s  383/534 msgs left
msg Sent/546 {958}           copied to Sent/327        12.30 msgs/s  1.571 MiB/s 19.407 MiB copied ETA: sábado 26 agosto 2023-08-26 17:49:37 -0400 CDT  31 s  382/534 msgs left
msg Sent/547 {1042}          copied to Sent/328        12.33 msgs/s  1.564 MiB/s 19.408 MiB copied ETA: sábado 26 agosto 2023-08-26 17:49:36 -0400 CDT  31 s  381/534 msgs left
msg Sent/549 {1061}          copied to Sent/329        12.35 msgs/s  1.557 MiB/s 19.409 MiB copied ETA: sábado 26 agosto 2023-08-26 17:49:36 -0400 CDT  31 s  380/534 msgs left
msg Sent/551 {977}           copied to Sent/330        12.37 msgs/s  1.550 MiB/s 19.410 MiB copied ETA: sábado 26 agosto 2023-08-26 17:49:36 -0400 CDT  31 s  379/534 msgs left
msg Sent/552 {5345}          copied to Sent/331        12.39 msgs/s  1.542 MiB/s 19.415 MiB copied ETA: sábado 26 agosto 2023-08-26 17:49:36 -0400 CDT  31 s  378/534 msgs left
msg Sent/576 {968}           copied to Sent/332        12.41 msgs/s  1.535 MiB/s 19.416 MiB copied ETA: sábado 26 agosto 2023-08-26 17:49:36 -0400 CDT  30 s  377/534 msgs left
msg Sent/585 {976}           copied to Sent/333        12.43 msgs/s  1.528 MiB/s 19.417 MiB copied ETA: sábado 26 agosto 2023-08-26 17:49:36 -0400 CDT  30 s  376/534 msgs left
msg Sent/590 {1071}          copied to Sent/334        12.46 msgs/s  1.521 MiB/s 19.418 MiB copied ETA: sábado 26 agosto 2023-08-26 17:49:36 -0400 CDT  30 s  375/534 msgs left
msg Sent/592 {1066}          copied to Sent/335        12.48 msgs/s  1.514 MiB/s 19.419 MiB copied ETA: sábado 26 agosto 2023-08-26 17:49:36 -0400 CDT  30 s  374/534 msgs left
msg Sent/595 {1069}          copied to Sent/336        12.49 msgs/s  1.507 MiB/s 19.420 MiB copied ETA: sábado 26 agosto 2023-08-26 17:49:36 -0400 CDT  30 s  373/534 msgs left
msg Sent/598 {2836}          copied to Sent/337        12.51 msgs/s  1.500 MiB/s 19.423 MiB copied ETA: sábado 26 agosto 2023-08-26 17:49:36 -0400 CDT  30 s  372/534 msgs left
msg Sent/600 {995}           copied to Sent/338        12.53 msgs/s  1.493 MiB/s 19.424 MiB copied ETA: sábado 26 agosto 2023-08-26 17:49:36 -0400 CDT  30 s  371/534 msgs left
msg Sent/603 {983}           copied to Sent/339        12.54 msgs/s  1.486 MiB/s 19.425 MiB copied ETA: sábado 26 agosto 2023-08-26 17:49:36 -0400 CDT  30 s  370/534 msgs left
msg Sent/607 {2023}          copied to Sent/340        12.57 msgs/s  1.480 MiB/s 19.427 MiB copied ETA: sábado 26 agosto 2023-08-26 17:49:36 -0400 CDT  29 s  369/534 msgs left
msg Sent/614 {1096}          copied to Sent/341        12.59 msgs/s  1.473 MiB/s 19.428 MiB copied ETA: sábado 26 agosto 2023-08-26 17:49:36 -0400 CDT  29 s  368/534 msgs left
msg Sent/615 {840}           copied to Sent/342        12.61 msgs/s  1.467 MiB/s 19.429 MiB copied ETA: sábado 26 agosto 2023-08-26 17:49:36 -0400 CDT  29 s  367/534 msgs left
msg Sent/616 {965}           copied to Sent/343        12.62 msgs/s  1.460 MiB/s 19.429 MiB copied ETA: sábado 26 agosto 2023-08-26 17:49:35 -0400 CDT  29 s  366/534 msgs left
msg Sent/624 {1106}          copied to Sent/344        12.63 msgs/s  1.452 MiB/s 19.431 MiB copied ETA: sábado 26 agosto 2023-08-26 17:49:35 -0400 CDT  29 s  365/534 msgs left
msg Sent/629 {953}           copied to Sent/345        12.65 msgs/s  1.446 MiB/s 19.431 MiB copied ETA: sábado 26 agosto 2023-08-26 17:49:35 -0400 CDT  29 s  364/534 msgs left
msg Sent/656 {1101}          copied to Sent/346        12.67 msgs/s  1.440 MiB/s 19.432 MiB copied ETA: sábado 26 agosto 2023-08-26 17:49:35 -0400 CDT  29 s  363/534 msgs left
msg Sent/658 {677}           copied to Sent/347        12.69 msgs/s  1.434 MiB/s 19.433 MiB copied ETA: sábado 26 agosto 2023-08-26 17:49:35 -0400 CDT  29 s  362/534 msgs left
msg Sent/661 {408}           copied to Sent/348        12.71 msgs/s  1.427 MiB/s 19.434 MiB copied ETA: sábado 26 agosto 2023-08-26 17:49:35 -0400 CDT  28 s  361/534 msgs left
msg Sent/675 {459}           copied to Sent/349        12.72 msgs/s  1.421 MiB/s 19.434 MiB copied ETA: sábado 26 agosto 2023-08-26 17:49:35 -0400 CDT  28 s  360/534 msgs left
msg Sent/678 {959}           copied to Sent/350        12.74 msgs/s  1.415 MiB/s 19.435 MiB copied ETA: sábado 26 agosto 2023-08-26 17:49:35 -0400 CDT  28 s  359/534 msgs left
msg Sent/679 {422}           copied to Sent/351        12.76 msgs/s  1.410 MiB/s 19.435 MiB copied ETA: sábado 26 agosto 2023-08-26 17:49:35 -0400 CDT  28 s  358/534 msgs left
msg Sent/682 {440}           copied to Sent/352        12.78 msgs/s  1.403 MiB/s 19.436 MiB copied ETA: sábado 26 agosto 2023-08-26 17:49:35 -0400 CDT  28 s  357/534 msgs left
msg Sent/684 {2646}          copied to Sent/353        12.80 msgs/s  1.398 MiB/s 19.438 MiB copied ETA: sábado 26 agosto 2023-08-26 17:49:35 -0400 CDT  28 s  356/534 msgs left
msg Sent/686 {492}           copied to Sent/354        12.81 msgs/s  1.392 MiB/s 19.439 MiB copied ETA: sábado 26 agosto 2023-08-26 17:49:35 -0400 CDT  28 s  355/534 msgs left
msg Sent/692 {437}           copied to Sent/355        12.83 msgs/s  1.386 MiB/s 19.439 MiB copied ETA: sábado 26 agosto 2023-08-26 17:49:35 -0400 CDT  28 s  354/534 msgs left
msg Sent/693 {433}           copied to Sent/356        12.84 msgs/s  1.379 MiB/s 19.440 MiB copied ETA: sábado 26 agosto 2023-08-26 17:49:35 -0400 CDT  27 s  353/534 msgs left
msg Sent/696 {419}           copied to Sent/357        12.86 msgs/s  1.374 MiB/s 19.440 MiB copied ETA: sábado 26 agosto 2023-08-26 17:49:35 -0400 CDT  27 s  352/534 msgs left
msg Sent/699 {1002}          copied to Sent/358        12.88 msgs/s  1.368 MiB/s 19.441 MiB copied ETA: sábado 26 agosto 2023-08-26 17:49:35 -0400 CDT  27 s  351/534 msgs left
msg Sent/703 {441}           copied to Sent/359        12.89 msgs/s  1.362 MiB/s 19.441 MiB copied ETA: sábado 26 agosto 2023-08-26 17:49:35 -0400 CDT  27 s  350/534 msgs left
msg Sent/708 {1017}          copied to Sent/360        12.91 msgs/s  1.357 MiB/s 19.442 MiB copied ETA: sábado 26 agosto 2023-08-26 17:49:35 -0400 CDT  27 s  349/534 msgs left
msg Sent/729 {7332}          copied to Sent/361        12.93 msgs/s  1.352 MiB/s 19.449 MiB copied ETA: sábado 26 agosto 2023-08-26 17:49:34 -0400 CDT  27 s  348/534 msgs left
msg Sent/745 {1014}          copied to Sent/362        12.94 msgs/s  1.346 MiB/s 19.450 MiB copied ETA: sábado 26 agosto 2023-08-26 17:49:34 -0400 CDT  27 s  347/534 msgs left
msg Sent/752 {995}           copied to Sent/363        12.96 msgs/s  1.341 MiB/s 19.451 MiB copied ETA: sábado 26 agosto 2023-08-26 17:49:34 -0400 CDT  27 s  346/534 msgs left
msg Sent/765 {302470}        copied to Sent/364        12.92 msgs/s  1.349 MiB/s 19.740 MiB copied ETA: sábado 26 agosto 2023-08-26 17:49:35 -0400 CDT  27 s  345/534 msgs left
msg Sent/782 {1015}          copied to Sent/365        12.97 msgs/s  1.348 MiB/s 19.741 MiB copied ETA: sábado 26 agosto 2023-08-26 17:49:34 -0400 CDT  27 s  344/534 msgs left
msg Sent/785 {979}           copied to Sent/366        12.99 msgs/s  1.342 MiB/s 19.742 MiB copied ETA: sábado 26 agosto 2023-08-26 17:49:34 -0400 CDT  26 s  343/534 msgs left
msg Sent/788 {995}           copied to Sent/367        13.00 msgs/s  1.337 MiB/s 19.742 MiB copied ETA: sábado 26 agosto 2023-08-26 17:49:34 -0400 CDT  26 s  342/534 msgs left
msg Sent/795 {34580}         copied to Sent/368        13.01 msgs/s  1.333 MiB/s 19.775 MiB copied ETA: sábado 26 agosto 2023-08-26 17:49:34 -0400 CDT  26 s  341/534 msgs left
msg Sent/800 {34461}         copied to Sent/369        13.01 msgs/s  1.328 MiB/s 19.808 MiB copied ETA: sábado 26 agosto 2023-08-26 17:49:34 -0400 CDT  26 s  340/534 msgs left
msg Sent/841 {997}           copied to Sent/370        13.02 msgs/s  1.323 MiB/s 19.809 MiB copied ETA: sábado 26 agosto 2023-08-26 17:49:34 -0400 CDT  26 s  339/534 msgs left
msg Sent/844 {994}           copied to Sent/371        13.04 msgs/s  1.318 MiB/s 19.810 MiB copied ETA: sábado 26 agosto 2023-08-26 17:49:34 -0400 CDT  26 s  338/534 msgs left
msg Sent/980 {5257}          copied to Sent/372        13.05 msgs/s  1.313 MiB/s 19.815 MiB copied ETA: sábado 26 agosto 2023-08-26 17:49:34 -0400 CDT  26 s  337/534 msgs left
msg Sent/1069 {1054}         copied to Sent/373        13.06 msgs/s  1.307 MiB/s 19.816 MiB copied ETA: sábado 26 agosto 2023-08-26 17:49:34 -0400 CDT  26 s  336/534 msgs left
msg Sent/1073 {964}          copied to Sent/374        13.07 msgs/s  1.301 MiB/s 19.817 MiB copied ETA: sábado 26 agosto 2023-08-26 17:49:34 -0400 CDT  26 s  335/534 msgs left
msg Sent/1075 {992}          copied to Sent/375        13.08 msgs/s  1.297 MiB/s 19.818 MiB copied ETA: sábado 26 agosto 2023-08-26 17:49:34 -0400 CDT  26 s  334/534 msgs left
msg Sent/1079 {1077}         copied to Sent/376        13.10 msgs/s  1.292 MiB/s 19.819 MiB copied ETA: sábado 26 agosto 2023-08-26 17:49:34 -0400 CDT  25 s  333/534 msgs left
msg Sent/1082 {1074}         copied to Sent/377        13.11 msgs/s  1.286 MiB/s 19.820 MiB copied ETA: sábado 26 agosto 2023-08-26 17:49:34 -0400 CDT  25 s  332/534 msgs left
msg Sent/1086 {1133}         copied to Sent/378        13.13 msgs/s  1.282 MiB/s 19.821 MiB copied ETA: sábado 26 agosto 2023-08-26 17:49:34 -0400 CDT  25 s  331/534 msgs left
msg Sent/1101 {1063}         copied to Sent/379        13.14 msgs/s  1.276 MiB/s 19.822 MiB copied ETA: sábado 26 agosto 2023-08-26 17:49:34 -0400 CDT  25 s  330/534 msgs left
msg Sent/1103 {1158}         copied to Sent/380        13.15 msgs/s  1.272 MiB/s 19.823 MiB copied ETA: sábado 26 agosto 2023-08-26 17:49:34 -0400 CDT  25 s  329/534 msgs left
msg Sent/1106 {1066}         copied to Sent/381        13.17 msgs/s  1.267 MiB/s 19.824 MiB copied ETA: sábado 26 agosto 2023-08-26 17:49:34 -0400 CDT  25 s  328/534 msgs left
msg Sent/1163 {1045}         copied to Sent/382        13.18 msgs/s  1.263 MiB/s 19.825 MiB copied ETA: sábado 26 agosto 2023-08-26 17:49:34 -0400 CDT  25 s  327/534 msgs left
msg Sent/1180 {1004}         copied to Sent/383        13.20 msgs/s  1.258 MiB/s 19.826 MiB copied ETA: sábado 26 agosto 2023-08-26 17:49:34 -0400 CDT  25 s  326/534 msgs left
msg Sent/1203 {1024}         copied to Sent/384        13.22 msgs/s  1.254 MiB/s 19.827 MiB copied ETA: sábado 26 agosto 2023-08-26 17:49:34 -0400 CDT  25 s  325/534 msgs left
msg Sent/1205 {1862}         copied to Sent/385        13.23 msgs/s  1.250 MiB/s 19.829 MiB copied ETA: sábado 26 agosto 2023-08-26 17:49:34 -0400 CDT  24 s  324/534 msgs left
msg Sent/1223 {2157615}      copied to Sent/386        12.93 msgs/s  1.342 MiB/s 21.887 MiB copied ETA: sábado 26 agosto 2023-08-26 17:49:34 -0400 CDT  25 s  323/534 msgs left
msg Sent/1224 {979}          copied to Sent/387        12.98 msgs/s  1.340 MiB/s 21.888 MiB copied ETA: sábado 26 agosto 2023-08-26 17:49:34 -0400 CDT  25 s  322/534 msgs left
msg Sent/1225 {981}          copied to Sent/388        12.99 msgs/s  1.335 MiB/s 21.889 MiB copied ETA: sábado 26 agosto 2023-08-26 17:49:34 -0400 CDT  25 s  321/534 msgs left
msg Sent/1280 {940}          copied to Sent/389        13.01 msgs/s  1.331 MiB/s 21.890 MiB copied ETA: sábado 26 agosto 2023-08-26 17:49:34 -0400 CDT  25 s  320/534 msgs left
msg Sent/1340 {977}          copied to Sent/390        13.03 msgs/s  1.326 MiB/s 21.890 MiB copied ETA: sábado 26 agosto 2023-08-26 17:49:34 -0400 CDT  24 s  319/534 msgs left
msg Sent/1343 {982}          copied to Sent/391        13.04 msgs/s  1.322 MiB/s 21.891 MiB copied ETA: sábado 26 agosto 2023-08-26 17:49:34 -0400 CDT  24 s  318/534 msgs left
msg Sent/1344 {991}          copied to Sent/392        13.06 msgs/s  1.317 MiB/s 21.892 MiB copied ETA: sábado 26 agosto 2023-08-26 17:49:34 -0400 CDT  24 s  317/534 msgs left
msg Sent/1380 {1196}         copied to Sent/393        13.07 msgs/s  1.312 MiB/s 21.893 MiB copied ETA: sábado 26 agosto 2023-08-26 17:49:34 -0400 CDT  24 s  316/534 msgs left
msg Sent/1400 {1109}         copied to Sent/394        13.07 msgs/s  1.307 MiB/s 21.895 MiB copied ETA: sábado 26 agosto 2023-08-26 17:49:34 -0400 CDT  24 s  315/534 msgs left
msg Sent/1420 {1036}         copied to Sent/395        13.08 msgs/s  1.302 MiB/s 21.896 MiB copied ETA: sábado 26 agosto 2023-08-26 17:49:34 -0400 CDT  24 s  314/534 msgs left
msg Sent/1423 {1081}         copied to Sent/396        13.10 msgs/s  1.298 MiB/s 21.897 MiB copied ETA: sábado 26 agosto 2023-08-26 17:49:34 -0400 CDT  24 s  313/534 msgs left
msg Sent/1440 {967}          copied to Sent/397        13.11 msgs/s  1.293 MiB/s 21.897 MiB copied ETA: sábado 26 agosto 2023-08-26 17:49:34 -0400 CDT  24 s  312/534 msgs left
ETA: sábado 26 agosto 2023-08-26 17:49:34 -0400 CDT  24 s  312/534 msgs left
Folder     7/7 [Trash]                             -> [Trash]                            
Host1: folder [Trash] has 312 messages in total (mentioned by SELECT)
Host2: folder [Trash] has 1052 messages in total (mentioned by SELECT)
Host2: folder [Trash] permanentflags: 
Host1: folder [Trash] considering 312 messages
Host2: folder [Trash] considering 1052 messages
Host1: folder [Trash] selected 312 messages, duplicates 0
Host2: folder [Trash] selected 1052 messages, duplicates 506
ETA: sábado 26 agosto 2023-08-26 17:49:11 -0400 CDT  0 s  0/534 msgs left
++++ End looping on each folder

Folders sizes after the synchronization.
You can remove this foldersizes listing by using  "--nofoldersizesatend"
Host1 folder     1/7 [Comments]                          Size:         0 Messages:     0 Biggest:         0
Host2 folder     1/7 [Comments]                          Size:         0 Messages:     0 Biggest:         0
Host2-Host1                                                            0               0                  0

Host1 folder     2/7 [Drafts]                            Size:         0 Messages:     0 Biggest:         0
Host2 folder     2/7 [Drafts]                            Size:         0 Messages:     0 Biggest:         0
Host2-Host1                                                            0               0                  0

Host1 folder     3/7 [INBOX]                             Size:   4713809 Messages:    33 Biggest:   2411346
Host2 folder     3/7 [INBOX]                             Size:   4713809 Messages:    33 Biggest:   2411346
Host2-Host1                                                            0               0                  0

Host1 folder     4/7 [Junk]                              Size:         0 Messages:     0 Biggest:         0
Host2 folder     4/7 [Junk]                              Size:         0 Messages:     0 Biggest:         0
Host2-Host1                                                            0               0                  0

Host1 folder     5/7 [Notes]                             Size:         0 Messages:     0 Biggest:         0
Host2 folder     5/7 [Notes]                             Size:         0 Messages:     0 Biggest:         0
Host2-Host1                                                            0               0                  0

Host1 folder     6/7 [Sent]                              Size:  18247349 Messages:   189 Biggest:   4898722
Host2 folder     6/7 [Sent]                              Size:  18247545 Messages:   189 Biggest:   4898722
Host2-Host1                                                          196               0                  0

Host1 folder     7/7 [Trash]                             Size:  60203812 Messages:   312 Biggest:  10004307
Host2 folder     7/7 [Trash]                             Size: 181002450 Messages:  1052 Biggest:  10004307
Host2-Host1                                                    120798638             740                  0

Host1 Nb folders:                     7 folders
Host2 Nb folders:                     7 folders

Host1 Nb messages:                  534 messages
Host2 Nb messages:                 1274 messages

Host1 Total size:              83164970 bytes (79.312 MiB)
Host2 Total size:             203963804 bytes (194.515 MiB)

Host1 Biggest message:         10004307 bytes (9.541 MiB)
Host2 Biggest message:         10004307 bytes (9.541 MiB)

Time spent on sizing:         0.6 seconds
++++ Statistics
Transfer started on                     : sábado 26 agosto 2023-08-26 17:48:52 -0400 CDT
Transfer ended on                       : sábado 26 agosto 2023-08-26 17:49:12 -0400 CDT
Transfer time                           : 20.1 sec
Folders synced                          : 7/7 synced
Messages transferred                    : 222 
Messages skipped                        : 312
Messages found duplicate on host1       : 0
Messages found duplicate on host2       : 506
Messages found crossduplicate on host2  : 0
Messages void (noheader) on host1       : 0  
Messages void (noheader) on host2       : 0
Messages found in host1 not in host2    : 0 messages
Messages found in host2 not in host1    : 12 messages
Messages deleted on host1               : 0
Messages deleted on host2               : 0
Total bytes transferred                 : 22961158 (21.897 MiB)
Total bytes skipped                     : 60203812 (57.415 MiB)
Message rate                            : 11.1 messages/s
Average bandwidth rate                  : 1116.6 KiB/s
Reconnections to host1                  : 0
Reconnections to host2                  : 0
Memory consumption at the end           : 190.0 MiB (*time 1.1 MiB*h) (started with 162.4 MiB)
Load end is                             : 4.51 2.24 1.05 5/1055 on 4 cores
CPU time and %cpu                       : 6.48 sec 32.3 %cpu 8.1 %allcpus
Biggest message transferred             : 4898722 bytes (4.672 MiB)
Memory/biggest message ratio            : 40.7
Start difference host2 - host1          : 518 messages, 97837480 bytes (93.305 MiB)
Final difference host2 - host1          : 740 messages, 120798834 bytes (115.203 MiB)
The sync looks good, all 534 identified messages in host1 are on host2.
There is no unidentified message on host1.
The sync is not strict, there are 12 among 546 identified messages in host2 that are not on host1. Use --delete2 and sync again to delete them and have a strict sync.
Detected 0 errors
Check if a new imapsync release is available by adding --releasecheck
Homepage: https://imapsync.lamiral.info/
Exiting with return value 0 (EX_OK: successful termination) 0/50 nb_errors/max_errors PID 12847
Removing pidfile /tmp/imapsync.pid
Log file is LOG_imapsync/2023_08_26_17_48_52_250_manuel.gorrin@umcc.cu_manuel.gorrin@umcc.cu.txt ( to change it, use --logfile filepath ; or use --nolog to turn off logging )
